{
  "$schema": "https://schemas.ui.le-mn.com/provider-registry/v1.json",
  "schemaVersion": 1,
  "registryId": "lemn-ui",
  "revision": "1.1.0",
  "sourceOfTruth": {
    "kind": "git_manifest",
    "repository": "https://github.com/lemn-ltd/ui",
    "path": "packages/provider-registry/registry/provider-registry.v1.json"
  },
  "licensePolicy": {
    "automaticAllowlist": [
      "MIT",
      "Apache-2.0",
      "BSD-2-Clause",
      "BSD-3-Clause",
      "ISC"
    ],
    "manualReview": [
      "MPL-2.0",
      "LGPL-2.1-only",
      "LGPL-3.0-only"
    ],
    "denied": [
      "GPL-2.0-only",
      "GPL-3.0-only",
      "AGPL-3.0-only",
      "SSPL-1.0",
      "BUSL-1.1",
      "Commons-Clause",
      "LicenseRef-Proprietary",
      "LicenseRef-Source-Available"
    ]
  },
  "sbom": {
    "format": "SPDX-2.3",
    "path": "third-party/sbom.spdx.json",
    "sha256": "1bd46c5235442d652f66365004ad99096810597534e673492d470869554e008f"
  },
  "capabilities": [
    {
      "capabilityId": "ui.primitive.checkbox",
      "implementationId": "radix-ui.checkbox@1.4.3",
      "publicExport": "Checkbox",
      "category": "inputs",
      "maturity": "stable",
      "lifecycle": "active",
      "providerOfRecord": true,
      "provider": {
        "id": "radix-ui",
        "name": "Radix UI",
        "repository": "https://github.com/radix-ui/primitives"
      },
      "source": {
        "ingestionMode": "runtime_dependency",
        "packageName": "radix-ui",
        "packageVersion": "1.4.3",
        "packageIntegrity": "sha512-aWizCQiyeAenIdUbqEpXgRA1ya65P13NKn/W8rWkcN0OPkRDxdBVLWnIEDsS2RpwCK2nobI7oMUSmexzTDyAmA==",
        "dependencyMode": "runtime_dependency",
        "packagePaths": [
          "src/index.ts",
          "dist/index.mjs"
        ]
      },
      "license": {
        "spdx": "MIT",
        "reviewClass": "automatic",
        "copyright": "Copyright (c) 2022 WorkOS",
        "requirements": [
          "Preserve the copyright and permission notice in copies or substantial portions."
        ],
        "files": [
          {
            "kind": "LICENSE",
            "path": "third-party/licenses/radix-ui-1.4.3-LICENSE.txt",
            "sha256": "0e80a2d229d2fd4fc7e8636142ec5d0ff0bc031f14c15b682e2ac01dfd5b5138"
          }
        ]
      },
      "adapters": {
        "publicApi": "packages/ui/src/primitives/checkbox/checkbox.tsx",
        "theme": "packages/ui/src/primitives/checkbox/checkbox.css"
      },
      "brandTokenRoles": [
        "color.accent",
        "color.accentcontrast",
        "color.border",
        "color.focus",
        "radius.control"
      ],
      "conformance": {
        "behavior": [
          "packages/ui/src/primitives/checkbox/tests/checkbox.spec.tsx"
        ],
        "accessibility": [
          "apps/ui-portal/tests/e2e/accessibility.e2e.ts"
        ],
        "interaction": [
          "apps/ui-portal/tests/e2e/checkbox-reference.e2e.ts"
        ],
        "visual": [
          "apps/ui-portal/tests/e2e/visual.e2e.ts"
        ],
        "ssr": [],
        "bundle": []
      },
      "upstream": {
        "lastSuccessfulSync": "2026-07-15T00:00:00Z",
        "updateStatus": "update_available",
        "upstreamReference": "https://www.npmjs.com/package/radix-ui/v/1.6.2"
      }
    },
    {
      "capabilityId": "ui.visualization.line-chart",
      "implementationId": "recharts.line-chart@3.9.2",
      "publicExport": "LineChart",
      "category": "visualizations",
      "maturity": "beta",
      "lifecycle": "active",
      "providerOfRecord": true,
      "provider": {
        "id": "recharts",
        "name": "Recharts",
        "repository": "https://github.com/recharts/recharts"
      },
      "source": {
        "ingestionMode": "runtime_dependency",
        "packageName": "recharts",
        "packageVersion": "3.9.2",
        "packageIntegrity": "sha512-G4fy+Pk46RaXgwWMh+Nzhyo/lbFAVqXo9gtetlyehe6Ehge9CsgDuOTwQDD+i1+llaLktNBiNq4bhnGlDRXFtw==",
        "dependencyMode": "runtime_dependency",
        "packagePaths": [
          "es6/chart/LineChart.js",
          "es6/index.js"
        ]
      },
      "license": {
        "spdx": "MIT",
        "reviewClass": "automatic",
        "copyright": "Copyright (c) 2015-present recharts",
        "requirements": [
          "Preserve the copyright and permission notice in copies or substantial portions."
        ],
        "files": [
          {
            "kind": "LICENSE",
            "path": "third-party/licenses/recharts-3.9.2-LICENSE.txt",
            "sha256": "e65e92a0a65f60ce02250fabb81a3211a77289c2ca097b209b4a3e3448ca6f91"
          }
        ]
      },
      "adapters": {
        "publicApi": "packages/ui/src/visualizations/line-chart/line-chart.tsx",
        "theme": "packages/ui/src/visualizations/line-chart/line-chart.css"
      },
      "brandTokenRoles": [
        "color.surface",
        "color.text",
        "visualization.axis",
        "visualization.grid",
        "visualization.series"
      ],
      "conformance": {
        "behavior": [
          "packages/ui/src/visualizations/line-chart/tests/line-chart.spec.tsx"
        ],
        "accessibility": [
          "apps/ui-portal/tests/e2e/accessibility.e2e.ts"
        ],
        "interaction": [
          "apps/ui-portal/tests/benchmark/visualization-performance.mjs"
        ],
        "visual": [
          "apps/ui-portal/tests/e2e/visual.e2e.ts"
        ],
        "ssr": [],
        "bundle": [
          "scripts/check-ui-bundles.mjs"
        ]
      },
      "upstream": {
        "lastSuccessfulSync": "2026-07-15T00:00:00Z",
        "updateStatus": "current",
        "upstreamReference": "https://www.npmjs.com/package/recharts/v/3.9.2"
      }
    },
    {
      "capabilityId": "ui.visualization.heatmap-chart",
      "implementationId": "echarts.heatmap-chart@6.1.0",
      "publicExport": "HeatmapChart",
      "category": "visualizations",
      "maturity": "beta",
      "lifecycle": "active",
      "providerOfRecord": true,
      "provider": {
        "id": "apache-echarts",
        "name": "Apache ECharts",
        "repository": "https://github.com/apache/echarts"
      },
      "source": {
        "ingestionMode": "runtime_dependency",
        "packageName": "echarts",
        "packageVersion": "6.1.0",
        "packageIntegrity": "sha512-q0yaFPggC9FUdsWH4blavRWFmxdrIodbkoKNAjJudAI6CA9gNPxHtV2RcZNEepZVlk4yvBYkOkbk6HIVpIyHZA==",
        "dependencyMode": "runtime_dependency",
        "packagePaths": [
          "index.js",
          "types/dist/all.d.ts"
        ]
      },
      "license": {
        "spdx": "Apache-2.0",
        "reviewClass": "automatic",
        "copyright": "Copyright 2017-2026 The Apache Software Foundation",
        "requirements": [
          "Distribute the Apache-2.0 license and Apache ECharts NOTICE attribution.",
          "Preserve the embedded d3 BSD-3-Clause copyright, conditions, and disclaimer."
        ],
        "files": [
          {
            "kind": "LICENSE",
            "path": "third-party/licenses/echarts-6.1.0-LICENSE.txt",
            "sha256": "634293835b43a6dd2094fa39182a3d9a6b9ca43b7fdb9ac354e8037af2a3093a"
          },
          {
            "kind": "NOTICE",
            "path": "third-party/licenses/echarts-6.1.0-NOTICE.txt",
            "sha256": "d491d358344f842685c1b1585970999db65fe30ecf7ef3867af8814f4016c016"
          },
          {
            "kind": "LICENSE",
            "path": "third-party/licenses/echarts-6.1.0-d3-LICENSE.txt",
            "sha256": "e1211892da0b0e0585b7aebe8f98c1274fba15bafe47fa1f4ee8a7a502c06304"
          }
        ]
      },
      "adapters": {
        "publicApi": "packages/ui/src/visualizations/heatmap-chart/heatmap-chart.tsx",
        "theme": "packages/ui/src/visualizations/heatmap-chart/heatmap-chart.css"
      },
      "brandTokenRoles": [
        "color.border",
        "color.canvas",
        "color.surface",
        "color.text",
        "visualization.axis",
        "visualization.series",
        "visualization.tooltip"
      ],
      "conformance": {
        "behavior": [
          "packages/ui/src/visualizations/heatmap-chart/tests/heatmap-chart.spec.tsx"
        ],
        "accessibility": [
          "packages/ui/src/visualizations/heatmap-chart/tests/heatmap-chart.spec.tsx",
          "apps/ui-portal/tests/e2e/accessibility.e2e.ts"
        ],
        "interaction": [
          "packages/ui/src/visualizations/heatmap-chart/tests/heatmap-chart.spec.tsx"
        ],
        "visual": [
          "apps/ui-portal/tests/e2e/visual.e2e.ts"
        ],
        "ssr": [
          "packages/ui/src/visualizations/heatmap-chart/tests/heatmap-chart.spec.tsx"
        ],
        "bundle": [
          "scripts/check-ui-bundles.mjs"
        ]
      },
      "upstream": {
        "lastSuccessfulSync": "2026-07-15T00:00:00Z",
        "updateStatus": "current",
        "upstreamReference": "https://www.npmjs.com/package/echarts/v/6.1.0"
      }
    },
    {
      "capabilityId": "ui.core.tracker",
      "implementationId": "tremor.tracker@ca4d588f47820ff3d514d37fa4ee08a4222dec11",
      "publicExport": "Tracker",
      "category": "visualizations",
      "maturity": "beta",
      "lifecycle": "active",
      "providerOfRecord": true,
      "provider": {
        "id": "tremor",
        "name": "Tremor",
        "repository": "https://github.com/tremorlabs/tremor"
      },
      "source": {
        "ingestionMode": "source_snapshot",
        "commitSha": "ca4d588f47820ff3d514d37fa4ee08a4222dec11",
        "selectedSourcePaths": [
          "src/components/Tracker/Tracker.tsx"
        ],
        "closure": [
          {
            "upstreamPath": "package.json",
            "localPath": "third-party/source-snapshots/tremor/ca4d588f47820ff3d514d37fa4ee08a4222dec11/package.json.snapshot",
            "upstreamSha256": "99c15b47666aa9e87076f8daa22df090e7596ec68e2b3fce37349aaef2b0c3d1",